{
  "$schema": "https://json-schema.org/draft/2020-12/schema",
  "title": "Mollification supplement batched reference budget plan v5",
  "type": "object", "additionalProperties": false,
  "required": ["schema", "name", "protocol_sha256", "audit_report_sha256", "supplement_anchor_lock_sha256", "predecessor_failure", "derivation", "reference_budget", "accumulator"],
  "properties": {
    "schema": {"const": {"name": "mollification-supplement-budget", "version": 5}},
    "name": {"const": "layer-stack-p1-mollification-reference-se-v6"},
    "protocol_sha256": {"const": "7160bd6f210038a6d2f39cac3ec513287b0cacab3ffb94423737c8e4d0cbbec2"},
    "audit_report_sha256": {"const": "c85474bc96f8cbf80fd62ded7257e9011cf1f4e0d5150dc05c6ff9c7ede7c13d"},
    "supplement_anchor_lock_sha256": {"const": "23d865f167809c1e340c4ca9581ea1c1e813b9ef2c6dd7919b9383ff3a9204ac"},
    "predecessor_failure": {
      "type": "object", "additionalProperties": false,
      "required": ["name", "maximum_paths_per_jitter_per_replica", "state_id", "view_index", "level_index", "observed_relative_se_p95", "observed_relative_se_max", "published", "directory"],
      "properties": {
        "name": {"const": "layer-stack-p1-mollification-reference-se-v5"},
        "maximum_paths_per_jitter_per_replica": {"const": 65536},
        "state_id": {"const": "1796065779d0932fe7ded3cc2c40b84a8a19190dd7e68732f06bc518ae7fe54a"},
        "view_index": {"const": 2},
        "level_index": {"const": 0},
        "observed_relative_se_p95": {"const": 0.0307},
        "observed_relative_se_max": {"const": 0.319926},
        "published": {"const": false},
        "directory": {"const": "data/reference-responses/layer-stack-p1-mollification-v1-reference-se-v5"}
      }
    },
    "derivation": {
      "type": "object", "additionalProperties": false,
      "required": ["rule", "estimated_required_paths", "rounded_power_of_two"],
      "properties": {
        "rule": {"const": "replace-full-dispatch-with-batched-fixed-without-changing-cap"},
        "estimated_required_paths": {"const": 65536},
        "rounded_power_of_two": {"const": 65536}
      }
    },
    "reference_budget": {
      "type": "object", "additionalProperties": false,
      "required": ["initial_paths_per_jitter_per_replica", "maximum_paths_per_jitter_per_replica", "target_relative_se_p95", "maximum_group_relative_se", "jitter_count", "replica_count"],
      "properties": {
        "initial_paths_per_jitter_per_replica": {"const": 64},
        "maximum_paths_per_jitter_per_replica": {"const": 65536},
        "target_relative_se_p95": {"const": 0.06},
        "maximum_group_relative_se": {"const": 0.25},
        "jitter_count": {"const": 256},
        "replica_count": {"const": 2}
      }
    },
    "accumulator": {
      "type": "object", "additionalProperties": false,
      "required": ["name", "gpu_batch_samples_per_replica", "sample_offset", "cpu_accumulator", "implementation_uri", "implementation_sha256"],
      "properties": {
        "name": {"const": "batched-fixed-float64-welford-v1"},
        "gpu_batch_samples_per_replica": {"const": 256},
        "sample_offset": {"const": "contiguous-zero-based-v1"},
        "cpu_accumulator": {"const": "float64-parallel-welford-v1"},
        "implementation_uri": {"const": "src/ncls/data/reference.py"},
        "implementation_sha256": {"const": "8d97c4d5265f800cd2a82fa555e00a1ad7a4063f2b573d56d5200ffdd7970cc2"}
      }
    }
  }
}
