{
  "schema": {"name": "mollification-supplement-budget", "version": 5},
  "name": "layer-stack-p1-mollification-reference-se-v6",
  "protocol_sha256": "7160bd6f210038a6d2f39cac3ec513287b0cacab3ffb94423737c8e4d0cbbec2",
  "audit_report_sha256": "c85474bc96f8cbf80fd62ded7257e9011cf1f4e0d5150dc05c6ff9c7ede7c13d",
  "supplement_anchor_lock_sha256": "23d865f167809c1e340c4ca9581ea1c1e813b9ef2c6dd7919b9383ff3a9204ac",
  "predecessor_failure": {
    "name": "layer-stack-p1-mollification-reference-se-v5",
    "maximum_paths_per_jitter_per_replica": 65536,
    "state_id": "1796065779d0932fe7ded3cc2c40b84a8a19190dd7e68732f06bc518ae7fe54a",
    "view_index": 2,
    "level_index": 0,
    "observed_relative_se_p95": 0.0307,
    "observed_relative_se_max": 0.319926,
    "published": false,
    "directory": "data/reference-responses/layer-stack-p1-mollification-v1-reference-se-v5"
  },
  "derivation": {
    "rule": "replace-full-dispatch-with-batched-fixed-without-changing-cap",
    "estimated_required_paths": 65536,
    "rounded_power_of_two": 65536
  },
  "reference_budget": {
    "initial_paths_per_jitter_per_replica": 64,
    "maximum_paths_per_jitter_per_replica": 65536,
    "target_relative_se_p95": 0.06,
    "maximum_group_relative_se": 0.25,
    "jitter_count": 256,
    "replica_count": 2
  },
  "accumulator": {
    "name": "batched-fixed-float64-welford-v1",
    "gpu_batch_samples_per_replica": 256,
    "sample_offset": "contiguous-zero-based-v1",
    "cpu_accumulator": "float64-parallel-welford-v1",
    "implementation_uri": "src/ncls/data/reference.py",
    "implementation_sha256": "8d97c4d5265f800cd2a82fa555e00a1ad7a4063f2b573d56d5200ffdd7970cc2"
  }
}
